,index,Country,Discription,alpha-3
0,0,Algeria,"Population and housing censuses have been carried out in Algeria in 1967, 1977, 1987, 1998, and 2008. The next census was held in 2018.",DZA
1,2,Angola,"General censuses of population and housing (Portuguese:  (RGPH)) have been carried out in 1970 and 2014. The 1970 census counted 5,646,166 habitants. Preliminary results of the 2014 census have been published and final results will be published by the end of 2015. The 2014 census counted 25,789,024 habitants as of May 16, 2014.",AGO
2,4,Benin,"Population and housing censuses have been carried out in 1978, 1992, 2002 and 2013. 2013 census preliminary results have been published.  Final results will be published in 2015.",BEN
3,6,Botswana,"Censuses in Botswana are run by the . There have been twelve censuses in Botswana's history. The most recent was the , which occurred in August 2011.
The Institut National de la Statistique et de la Demographie has conducted four censuses: in 1975, 1985, 1996, and 2006.",BWA
4,8,Egypt,"The Statistical Department of the Ministry of Finance conducted the first census in 1882, which considered as a preparatory step; the first true population census was conducted in 1897. Thereafter, censuses were conducted at ten-year intervals in 1907, 1917, 1927 and so on. The last one being in 2017.
Three censuses have been taken in Ethiopia: 1984, 1994 and in 2007. The responsible institution is the . Most of the census in 2007 was taken in August, while the  and the  were not covered. The northern Afar region is a remote, hot and arid area. The eastern Somali region () hosts a large nomadic Somali population and is a conflict area where Ethiopian regular forces are fighting against  ().",EGY
5,10,Ethiopia,"Three censuses have been taken in Ethiopia: 1984, 1994 and in 2007. The responsible institution is the . Most of the census in 2007 was taken in August, while the  and the  were not covered. The northern Afar region is a remote, hot and arid area. The eastern Somali region () hosts a large nomadic Somali population and is a conflict area where Ethiopian regular forces are fighting against  ().",ETH
6,12,Kenya,"The first census in  was conducted in 1948, when Kenya was still a colony administered by the British. Since 1969 census has been taken every ten years. The last census to date was in 2019 and recorded a population of 47.6 million.",KEN
7,14,Mauritius,"Population and housing censuses for Mauritius was collected in 1972, 1983, 2000, and 2011; although respondents were asked to identify their race/ethnic origin in the 1972 census, this question was dropped from the following censuses because ""the government felt that it was a divisive question"". The Statistics Act directed that all official censuses be conducted by , as well as serve as the central depository for this information.",MUS
8,16,Morocco,"General censuses of population and housing (Arabic: الإحصاء العام للسكان والسكنى / French:  (RGPH)) have been carried out since independence in 1960, 1971, 1982, 1994, 2004 and 2014. The 2014 census results will be published on http://rgph-2014.hcp.ma/ by the end of 2014.
The first census was taken in 1980. The second in 1997. The third was taken August 1–14, 2007. The fourth and most recent was taken in 2017.
In accordance with the ,  conducts a Population and Housing Census every ten years. After  the first one was carried out in 1991, further rounds followed in 2001 and 2011. In Namibia, the  method is used. For enumeration purposes the country is demarcated into 4,042 . These areas do not overlap with constituency boundaries in order to get reliable data for election purposes as well.",MAR
9,18,Mozambique,"The first census was taken in 1980. The second in 1997. The third was taken August 1–14, 2007. The fourth and most recent was taken in 2017.
In accordance with the ,  conducts a Population and Housing Census every ten years. After  the first one was carried out in 1991, further rounds followed in 2001 and 2011. In Namibia, the  method is used. For enumeration purposes the country is demarcated into 4,042 . These areas do not overlap with constituency boundaries in order to get reliable data for election purposes as well.",MOZ
10,20,Namibia,"In accordance with the ,  conducts a Population and Housing Census every ten years. After  the first one was carried out in 1991, further rounds followed in 2001 and 2011. In Namibia, the  method is used. For enumeration purposes the country is demarcated into 4,042 . These areas do not overlap with constituency boundaries in order to get reliable data for election purposes as well.",NAM
11,22,Nigeria,"Population censuses have been taken in  during colonial time in 1866, 1871, 1896, 1901, 1911, 1921 and 1952. The censuses covered only the southern part of the country except for the 1952 census which was country wide, and the censuses before 1921 were based on administrative estimates rather than on an actual enumeration.
Censuses during independence were taken 1962, 1963, 1973, 1991 and 2006. The results of the 1962 census were considered inaccurate enough that a new census was ordered on February 19, 1963. The results from 1973 and 2006 were highly disputed, but no recounts were taken. The preliminary results for 2006 indicates a population of 140 million people. 700,000 enumerators were engaged in this operation.
The first census of South Africa was taken in 1911. Several enumerations have occurred since then, with the most recent three being carried out by  in 1996,  and .
Population censuses have been carried out in  in 1955/56, 1973 (national), 1983 (national) and 1993 (only north). A census was conducted in April 2008. Some areas—namely , , and —were difficult to measure.
General population and housing censuses were carried out in 1960, 1970, 1981 and 2010.",NGA
12,24,Sudan,"Population censuses have been carried out in  in 1955/56, 1973 (national), 1983 (national) and 1993 (only north). A census was conducted in April 2008. Some areas—namely , , and —were difficult to measure.
General population and housing censuses were carried out in 1960, 1970, 1981 and 2010.",SDN
13,26,Togo,"General population and housing censuses were carried out in 1960, 1970, 1981 and 2010.",TGO
14,28,Tunisia,"General censuses of population and housing (French:  (RGPH)) have been carried out in 1921, 1926, 1931, 1936, 1946, 1956, 1966, 1975, 1984, 1994, 2004 and . First results (20%) were published in September 12, 2014, the final results will be published between January and December 2015.",TUN
15,30,Uganda,"The first censuses in  were taken in 1911, 1921 and 1931. It was done in a rather primitive way. The  unit was 'huts' and not individuals. More scientific censuses were taken 1948 and 1959 where the enumeration unit was persons. The census was however divided into two separate enumerations, one for Africans, and one for the non-African population.
The censuses during independence 1969, 1980, 1991 were taken jointly for all races. The censuses 1980 and 1991 included housing information and in addition a larger questionnaire for a sample of the population. However, the questionnaires for the 1980 were lost and only provisional figures are available from this census.
The census in 2002 involved some 50,000 enumerators and supervisors. It covered several topics including: population and housing; agriculture; and Micro- and small Enterprises administered at individual/household level. The Preliminary Results were published two weeks after the enumeration. The Final Results were released in March
2005, while the analytical findings and the district level results were scheduled to be released in the second quarter of 2006.",UGA
16,32,Afghanistan,"A partial and incomplete population census was taken in Afghanistan in June 1979.  Wars since then have caused significant population displacement and there has not been an updated count nor does the nation seem to have the technical ability nor will to tackle a modern census.
Population censuses have been taken in Azerbaijan under Russian/Soviet rule in 1897, 1926, 1937, 1939, 1959, 1970, 1979, and 1989. Beginning in 1991, two more census have been carried out in Azerbaijan: one in 1999 and one in 2009.",AFG
17,34,Azerbaijan,"Population censuses have been taken in Azerbaijan under Russian/Soviet rule in 1897, 1926, 1937, 1939, 1959, 1970, 1979, and 1989. Beginning in 1991, two more census have been carried out in Azerbaijan: one in 1999 and one in 2009.",AZE
18,36,Bangladesh,"Population censuses were conducted by the  (BBS) in 1974, 1981, 1991 and 2001. The 2011 Census was held from March 15 to 19.  Well over ten million Bangladeshis who live/moved to India were not included in the 2011 count,  while India's census 2011 count did include .  If repatriated, numbers would be skewed significantly and go some way to explain the missing people (as calculated from birthrates) in Bangladesh's count.Currently in 2021 hopefully another cencus will be held.
China's first censuses were irregular: the  held censuses in 1913 and 1944. Under , the People's Republic of China held its first in , but the second in  was secret and unacknowledged until the early 1980s.
The  was much more thorough and well-conducted than the first two, and similar censuses have been conducted decennially in 1990, 2000, and . These are the world's biggest censuses and over 6 million enumerators were engaged in the 2000 and 2010 censuses.
Between the national censuses, 1% National Population Sample Surveys were taken in 1987, 1995, and 2005; 0.1% National Population Sample Surveys have been taken annually since 2000. National agricultural, economic, and industrial censuses are also taken on a regular basis. The first economic census was taken in 2004 and the second 2008.",BGD
19,38,China,"China's first censuses were irregular: the  held censuses in 1913 and 1944. Under , the People's Republic of China held its first in , but the second in  was secret and unacknowledged until the early 1980s.
The  was much more thorough and well-conducted than the first two, and similar censuses have been conducted decennially in 1990, 2000, and . These are the world's biggest censuses and over 6 million enumerators were engaged in the 2000 and 2010 censuses.
Between the national censuses, 1% National Population Sample Surveys were taken in 1987, 1995, and 2005; 0.1% National Population Sample Surveys have been taken annually since 2000. National agricultural, economic, and industrial censuses are also taken on a regular basis. The first economic census was taken in 2004 and the second 2008.",CHN
20,40,India,The decennial census of  is the primary source of information about the demographic characteristics of the . The 2011 census is one of the largest censuses in the history of mankind.,IND
21,42,Indonesia,"The first population census was done during the colonial era, 1930. Before that, a non-overall census was already conducted in 1920. After that census was done irregularly. The first census after independence was 1961, followed by 1971. Since 1980 it is conducted regularly every 10 years. In between, there is also economical census (every 10 years, five years after population census) and agricultural census (three years after population census). The last census was held on May 2010.
The Statistical Center of Iran carried out nationwide population and housing censuses every 10 years, the last of which occurred in 2006 (1385 ). In the Islamic Republic of Iran, based on Article 4 of the Act of the Statistical Center of Iran (SCI), the census shall be implemented once every 10 years according to the Presidential decree. So far there have been six incidences of population census in Iran in the years 1956, 1966, 1976, 1986, 1996, and 2006. Since 2008 census in Iran is carried out once every 5 years.
The Central Statistical Organization - Ministry of Planning of Iraq is responsible for population and housing censuses.
According to the British government in Iraq, the population estimate in 1920 was 3 million. In 1927, the General Directorate of Population carried out the census, the population estimate was 2,968,054. Later, There were another 8 censuses in the years 1934, 1947, 1957, 1965, 1977, 1987 and the last one that was carried out in 1997.
After the , there was a plan for a new population and housing census. Data was collected and published in Central Statistical Organization website. Later, Data was updated, but no census was carried out due to country situation and dispute about census law.
The first census in the state of  was held in November 1948, six months after its creation, to establish the . Subsequent censuses were conducted by the  (ICBS) in 1961, 1972, 1983, 1995 and 2008. In these, 20% of households completed a detailed survey and the remainder a shorter questionnaire. There is no legal requirement to hold a census within a given interval; in practice, the ICBS requests and the government decides. The next census is scheduled for 2020.",IDN
22,44,Iraq,"The Central Statistical Organization - Ministry of Planning of Iraq is responsible for population and housing censuses.
According to the British government in Iraq, the population estimate in 1920 was 3 million. In 1927, the General Directorate of Population carried out the census, the population estimate was 2,968,054. Later, There were another 8 censuses in the years 1934, 1947, 1957, 1965, 1977, 1987 and the last one that was carried out in 1997.
After the , there was a plan for a new population and housing census. Data was collected and published in Central Statistical Organization website. Later, Data was updated, but no census was carried out due to country situation and dispute about census law.
The first census in the state of  was held in November 1948, six months after its creation, to establish the . Subsequent censuses were conducted by the  (ICBS) in 1961, 1972, 1983, 1995 and 2008. In these, 20% of households completed a detailed survey and the remainder a shorter questionnaire. There is no legal requirement to hold a census within a given interval; in practice, the ICBS requests and the government decides. The next census is scheduled for 2020.",IRQ
23,46,Israel,"The first census in the state of  was held in November 1948, six months after its creation, to establish the . Subsequent censuses were conducted by the  (ICBS) in 1961, 1972, 1983, 1995 and 2008. In these, 20% of households completed a detailed survey and the remainder a shorter questionnaire. There is no legal requirement to hold a census within a given interval; in practice, the ICBS requests and the government decides. The next census is scheduled for 2020.",ISR
24,48,Japan,"Japan collects census information every five years. The exercise is conducted by the Statistics Bureau of the Ministry of Internal Affairs and Communications. October 1, 2010 and 2015 are Population Census Day.",JPN
25,50,Jordan,"The first population census after the independence in 1946 was taken in 1952. It did only count the number of people in the households and could therefore be considered only to be a housing census. The first real complete census was taken in 1961. The following censuses have been taken in 1979, 1994 and 2004. The distribution of  and  within the population has been a politically sensitive issue since the  in 1967.
No census has been conducted in  since 1932. It indicated a population of 861,399 Lebanese. Various estimates of the population have been taken since; in 1956 it was estimated a population of 1,411,416, with 54% Christian and 44% Muslim. Conducting a census since then has been complicated by various conflicts in the 1970s and 1980s, as well as by the sensitivity of religious issues.",JOR
26,52,Lebanon,"No census has been conducted in  since 1932. It indicated a population of 861,399 Lebanese. Various estimates of the population have been taken since; in 1956 it was estimated a population of 1,411,416, with 54% Christian and 44% Muslim. Conducting a census since then has been complicated by various conflicts in the 1970s and 1980s, as well as by the sensitivity of religious issues.",LBN
27,54,Malaysia,"The census in  is carried out every 10 years, like many nations, since 1960 (with the exception of the fourth census, which was carried out in 1991). The next census should be carried out in 2020. The most recent census was from July 6 to August 22, 2010.
A general census of population and housing has been carried out in 2014. Provisional results have been published and final results will be published in May 2015. The 2014 census counted 51,419,420 inhabitants.",MYS
28,56,Myanmar,"A general census of population and housing has been carried out in 2014. Provisional results have been published and final results will be published in May 2015. The 2014 census counted 51,419,420 inhabitants.",MMR
29,58,Nepal,"Population censuses are conducted every tenth year in . The first was held in 1911 and the most recent was held in 2011.
Censuses have been taken in the  in 1993, 2003, and 2010.
The first  census after the proclamation of independence was conducted in 1951. It was decreed that censuses have to be carried out once in 10 years. The second census was conducted in 1961. However the third one was conducted in 1972 because of . The fourth census was held in 1981.The fifth census was delayed to March 1998. The sixth census of Pakistan was planned for October 2008, but was delayed due to political instability. The long overdue census was be held in March 2017, 19 years after the last one was undertaken.",NPL
30,60,Oman,"Censuses have been taken in the  in 1993, 2003, and 2010.
The first  census after the proclamation of independence was conducted in 1951. It was decreed that censuses have to be carried out once in 10 years. The second census was conducted in 1961. However the third one was conducted in 1972 because of . The fourth census was held in 1981.The fifth census was delayed to March 1998. The sixth census of Pakistan was planned for October 2008, but was delayed due to political instability. The long overdue census was be held in March 2017, 19 years after the last one was undertaken.",OMN
31,62,Pakistan,"The first  census after the proclamation of independence was conducted in 1951. It was decreed that censuses have to be carried out once in 10 years. The second census was conducted in 1961. However the third one was conducted in 1972 because of . The fourth census was held in 1981.The fifth census was delayed to March 1998. The sixth census of Pakistan was planned for October 2008, but was delayed due to political instability. The long overdue census was be held in March 2017, 19 years after the last one was undertaken.",PAK
32,64,Philippines,"The census of the  is enumerated every 5 years (beginning on 1960, except in 2005 where it was moved to 2007 due to budgetary constraints) and the results are used to allocate Congressional seats (congressional apportionment) and government program funding.
The census is performed by the . The first official census in the Philippines was carried out by the Spanish government pursuant to a royal decree calling for the counting of persons living as of the midnight of December 31, 1877. The first door-to-door census was conducted in 1903 to fulfill Public Act 467 which was approved by the U.S. Congress in July 1902. The last national census was held in 2010. For years between the censuses, the NSO issues estimates made using surveys and statistical models.
In , the first census of the tax-payers was made in 1722–1723 by the order of  (only men were counted), and was ordered to be repeated every twenty years. The only complete  was carried out in 1897. All-Union Population Censuses were carried out in the  (which included  and the other republics) in 1920 (urban only), , , 1939, 1959, 1970, 1979, and . The first post-Soviet  was carried out in 2002, followed by the . Currently, the census is the responsibility of the .
Population censuses have been taken in Saudi Arabia in 1962/63 (incomplete), 1974 (complete but not reliable), 1992, 2004 and 2010. An agriculture census was taken in 1999.
South Korea had a census in 2000.",PHL
33,66,Thailand,"A census is conducted every 10 years, the latest being in 2010. The  is in charge of conducting the census.
The  census is run by the . The first census in  was conducted in 1927. After 1935, it took place every 5 years until 1990. Now, the census takes place every 10 years. The last census was in 2000. It can be noted that the census enumeration takes place on one single day in Turkey (in other countries it takes 1–2 weeks). This required some 900,000 enumerators in 2000. The 15th census based on improved geographical information systems is planned for 2010.
A census was taken in the  1831–38 by  (1808–1839) as a part of the reform movement . Christian and  men were counted but the female population was excluded.
The last census in Uzbekistan was carried out in 1989 during Soviet rule.  Uzbekistan itself has never carried one out.
Population & Housing Censuses was carried out in 1991, 2001, and 2011. The  was released in May 2014.
National population censuses are carried out in Argentina roughly every ten years, the last ones having been carried out in 2001 and on October 27, 2010.
Censuses on population sizes in Barbados are conducted by the Barbados Statistical Service (BSS). The last major census was conducted in 2010.
Population and housing censuses have been carried out in 1992, 2001 and 2012.
The Brazilian census is carried out by the  every . The last one was in 2010. Earlier censuses were taken in 1872 (the first), 1900, 1920, 1941, 1950, 1960, 1970, 1980, 1991, 2000 and 2010.
Brazil's Demographic Census is one of the most  collection of census data in the world. Its hierarchies include: Brazil (Country), Major Regions, States, Macro-regions, micro-regions, municipalities, districts, sub-districts, Neighborhoods and census tracts.
Depending on the administrative hierarchy, some types of data are not published to respect confidentiality.
For example:
Information is collected with  equipped with GPS receivers and digitized maps.
 (IBGE)
The Canadian census is run by . The  was conducted by French  , when he took a census to ascertain the number of people living in . The method and data was later used when Canada was founded 201 years later. The individual provinces (sometimes in conjunction with each other) conducted censuses in the 19th century and before. In 1871, Canada's first formal census was conducted, which counted the population of , Ontario, , and .
Censuses in Canada are conducted in five-year intervals. The last census was conducted in 2016. Censuses taken in mid-decade (1976, 1986, 1996, etc.) are referred to as quinquennial censuses. Others are referred to as decennial censuses. The first quinquennial census was conducted in 1956.
For the 2006 Census of Canada, respondents were able to complete their census questionnaire online for the first time. Other options for answering the questionnaire included postal mail (using a pre-paid envelope) and telephone (using an ).
At a sub-national level, two provinces ( and ) and two territories ( and ) have legislation that allows local governments to conduct their own .",THA
