,index,Country,Discription,alpha-3
66,132,Portugal,"The first systematic census in Portugal was carried out in January 1, 1864. The census in  is carried out by  (INE) every . The last census was taken in March 21, 2011.
The first census in  was carried out in 1859. It is now carried out every ten years by the  (INSSE). The last census was in 2011.",PRT
67,134,Romania,The first census in  was carried out in 1859. It is now carried out every ten years by the  (INSSE). The last census was in 2011.,ROU
68,136,Serbia,"The census ordinarily takes place every 10 years. The last census was in 2011, the previous one was in 2002 (although having been planned for 2001) and the next is planned for 2021. The censuses before were organized in 1991, 1981, 1971, 1961, 1953 and 1948, during . During the , censuses were conducted in 1931 and 1921; the census in 1941 was never conducted due to the outbreak of WWII.
The autonomous , had conducted the first population census in 1834; the subsequent censuses were conducted in 1841, 1843, 1846, 1850, 1854, 1859, 1863 and 1866 and 1874. During the era of the independent , six censuses were conducted starting on 1884 and the last one being in 1910. And then the frequent wars had prevented organizing any census prior to the Yugoslav one in 1921.
For the portions of Serbia ruled by  until 1918, there were a total of five Austro-Hungarian censuses—1910, 1900, 1890, 1880 and 1869, immediately after the Dual Monarchy's constitution.",SRB
69,138,Slovakia,"First modern census in the area of today's  was taken in 1869. Today, the census is conducted every 10 years by the Statistical Office of Slovak Republic. Last census was in May 2011.
The first census of modern  was carried in 1991, after independence had been declared. The  conducted the second census in 2002. Further censuses were carried out in 2011 and then every 10 years.",SVK
70,140,Slovenia,"The first census of modern  was carried in 1991, after independence had been declared. The  conducted the second census in 2002. Further censuses were carried out in 2011 and then every 10 years.",SVN
71,142,Spain,"The census in Spain is carried out by  every . Although there has been an old tradition and like for making census in Spain, the oldest ones dating back to the 12th century (by  of the ), the first modern census was carried out in 1768 by , under the reign of . The last five were in 1971, 1981, 1991, 2001, and 2011.
The first population census in  was carried out in 1749. The last population and housing census was carried out in 1990. It is planned to conduct population and housing censuses based on registers in the future.
In , the  (German: , French: , : , : ) has been carried out every 10 years starting in 1850. The census was initiated by  , who evaluated the data of the first census all by himself after Parliament failed to provide the necessary funds. The census is now being conducted by the .
Data collected include population data (citizenship, place of residence, place of birth, position in household, number of children, religion, languages, education, profession, place of work, etc.), household data (number of individuals living in the household, etc.), accommodation data (surface area, amount of rent paid, etc.) and building data (geo, time of construction, number of floors, etc.). Participation is compulsory and reached 99.87% of the population in 2000.",ESP
72,144,Sweden,"The first population census in  was carried out in 1749. The last population and housing census was carried out in 1990. It is planned to conduct population and housing censuses based on registers in the future.
In , the  (German: , French: , : , : ) has been carried out every 10 years starting in 1850. The census was initiated by  , who evaluated the data of the first census all by himself after Parliament failed to provide the necessary funds. The census is now being conducted by the .
Data collected include population data (citizenship, place of residence, place of birth, position in household, number of children, religion, languages, education, profession, place of work, etc.), household data (number of individuals living in the household, etc.), accommodation data (surface area, amount of rent paid, etc.) and building data (geo, time of construction, number of floors, etc.). Participation is compulsory and reached 99.87% of the population in 2000.",SWE
73,146,Switzerland,"In , the  (German: , French: , : , : ) has been carried out every 10 years starting in 1850. The census was initiated by  , who evaluated the data of the first census all by himself after Parliament failed to provide the necessary funds. The census is now being conducted by the .
Data collected include population data (citizenship, place of residence, place of birth, position in household, number of children, religion, languages, education, profession, place of work, etc.), household data (number of individuals living in the household, etc.), accommodation data (surface area, amount of rent paid, etc.) and building data (geo, time of construction, number of floors, etc.). Participation is compulsory and reached 99.87% of the population in 2000.",CHE
74,148,Ukraine,"The first post-Soviet  was carried out by State Statistics Committee of Ukraine in 2001, 12 years after the last All-Union census in 1989.",UKR
75,150,Australia,"The Australian census is operated by the . It is currently conducted every five years, the last occurrence being on August 9, 2016. Past Australian censuses were conducted in , 1921, 1933, 1947, 1954, and 1961 – 2011 every five years. In 2016, for the first time,  were able to complete their census online.",AUS
